{
  "schema_version": "1.3",
  "task_id": "p0-b06",
  "topic": "Zero-Asset Baseline",
  "source_image": "source.png",
  "output_ratio": "16:9",
  "typography_interaction": "match-source",
  "typography": {
    "title_font": "Microsoft YaHei",
    "title_size_pt": 34,
    "body_font": "Microsoft YaHei",
    "body_size_pt": 18
  },
  "editability_policy": "text-and-structure",
  "user_requirements": [
    "Use native editable text, shapes, and connectors only.",
    "Produce zero crop entries and zero runtime image or SVG assets."
  ],
  "review_policy": {
    "max_iterations": 3,
    "pass_score": 90,
    "warning_floor_score": 85,
    "min_content_accuracy": 98,
    "required_editability_score": 100,
    "critical_policy": "by_recoverability"
  }
}
