{"editability_policy":"text-and-structure","output_ratio":"16:9","review_policy":{"critical_policy":"by_recoverability","max_iterations":4,"min_content_accuracy":98,"pass_score":90,"required_editability_score":100,"warning_floor_score":85},"schema_version":"1.3","source_image":"source.png","task_id":"p5-live-01","topic":"P2 Handoff","typography":{"body_font":"Microsoft YaHei","body_size_pt":16,"title_font":"Microsoft YaHei","title_size_pt":28},"typography_interaction":"default","user_requirements":[]}
